2024-11-15 08:50:02,"МОСКВА, 15 ноя - РИА Новости.Гадание на картах таро для якобы предсказания будущего – типичная лженаука, а тарологи – чистейшие мошенники, которые пользуются уязвимостью людей в сложных ситуациях, что может приводить к печальным последствиям для здоровья и жизни потребителей этих услуг, заявили РИА Новости в Российской академии наук.
""Эта сфера деятельности относится к типичной лженауке – нет никаких доказательств возможности предсказаний по картам таро или по звездам, не говоря уже о колдунах. Это мошенники чистой воды, которые пользуются уязвимостью людей в сложных ситуациях (проблемы со здоровьем, взаимоотношения в семье и прочее) и за деньги наживаются на этих людях, их обманывают"", - сказали в РАН.
""Никаких научных доказательств или хотя бы косвенных свидетельств реальности подобных эффектов нет, а эффект заключается в психологическом подчинении себе другого человека и навязывании ему этих услуг. Имеются случаи, когда больные тяжелыми смертельными заболеваниями вместо того, чтобы использовать подходы современной медицины, обращались к колдунам и гадалкам с печальным исходом. Это иначе чем преступлением назвать нельзя"", - добавили в Академии наук.
Ранее в РАН в комментарии РИА Новости назвали ""абсолютной лженаукой"" методы, применяемыеАнатолием Кашпировским."
2024-11-15 08:52:31,"МОСКВА, 15 ноя — РИА Новости.Владимир Зеленский заявил в вечернем видеообращении в Telegram-канале, что собирается представить новый план для Украины.""Всего десять пунктов, которые будут представлены на следующей неделе"", — сказал он.
Зеленский утверждает, что одним из пунктов будут ""культурный суверенитет"" и ""безопасное пространство"" для каждого человека. Также присутствуют положения об энергетике и вооружении.В октябре он представил ""план победы"", всего в нем пять пунктов и три секретных дополнения. В первом пункте идет речь о приглашенииУкраинывНАТО, во втором — о снятии ограничений на удары дальнобойным западным оружием по российской территории, в третьем — о размещении на территории Украины ""комплексного неядерного пакета сдерживания""России. По словам Зеленского, реализация плана зависит от западных партнеров.
Как отметил представитель КремляДмитрий Песков, ""план победы"" фактически повторяет планСШАвоевать с Россией до последнего украинца. По словам Пескова, для достижения мираКиевдолжен ""протрезветь"" и осознать бесперспективность политики, которую он проводит.
Официальный представитель российского МИДМария Захарова, в свою очередь, заявила, что это не план, а набор бессвязных лозунгов. По ее словам, он только подталкивает НАТО к прямому конфликту с Россией."
2024-11-15 08:55:38,"МОСКВА, 15 ноя — РИА Новости.ВТБ с 15 ноября повышает ставки по депозитам, сообщилапресс-службабанка.
Как уточнили в ВТБ, максимальную ставку смогут использовать новые клиенты, а также нынешние пользователи, если разместят ""новые для банка средства на депозите"".
Кроме того, участникам программы долгосрочных сбережений (ПДС) теперь доступна ставка в 30 процентов на три месяца по вкладу ""Двойная выгода"". Его условия весьма жесткие – согласно данным на сайте ВТБ, его можно открыть в течение двух недель после оформления договора ПДС, а сумма вклада не может превышать сумму первого взноса в программу.
Банк спрогнозировал, что по итогам года портфель его розничных пассивов во всех валютах вырастет в 1,5 раза, до 10,3 триллиона рублей, из них только в рублях – 9,6 триллиона, об этом в середине октября сообщал старший вице-президент ВТБ Дмитрий Брейтенбихер."
2024-11-15 08:56:01,"МОСКВА, 15 ноя - РИА Новости.Землетрясение магнитудой 6,6 было зафиксировано у берегов Папуа-Новой Гвинеи, сообщает геологическая служба США (USGS).
Подземные толчки были зафиксированы в 5.28 по времени UTC (8.28 мск) в 123 километрах к востоку-юго-востоку от города Кокопо. По данным сейсмологов, очаг залегал на глубине 51,9 километра.
Информация о возможных жертвах и разрушениях пока не поступала."
2024-11-15 08:58:49,"МОСКВА, 15 ноя — РИА Новости.Из западных СМИ исчезли новости о националистах на Украине, заявил ирландский журналист Чей Боуз в социальной сетиX.
""Западные корпоративные СМИ рассказывали правду об Украине. Сейчас? Все исчезло"", — написал он, прикрепив фото публикаций об украинских националистах в американских и европейских изданиях.
По словам Боуза, СМИ на Западе перестали публиковать подобные материалы после того, как Россия была вынуждена вмешаться в происходящее на Украине после многих лет провокаций и репрессий против этнических русских.
На прошлой неделе ветеран ГРУ, руководитель Центра военно-дипломатического анализа и оценокВладимир Винокуровзаявил РИА Новости, что для денацификации Украины необходимо устранение киевского режима. Он назвал первоочередной задачу нейтрализации угроз с территории Украины, поскольку киевские террористы могут попытаться дестабилизировать ситуацию на сопредельной российской территории, вплоть до прямого вторжения вглубьРоссии.
*Данная информация опубликована исключительно в информационных целях и имеет своей целью осуждение нацизма в любых его формах и проявлениях."
2024-11-15 08:59:48,"МОСКВА, 15 ноя - РИА Новости.Роберт Кеннеди-младший, которого победивший на выборах президента США Дональд Трамп выдвинул на должность главы минздрава в своей новой администрации,пообещалположить конец эпидемии хронических болезней и искоренить коррупцию в области здравоохранения.
Ранее Трамп написал в социальной сети Truth Social о намерении номинировать Кеннеди-младшего на пост министра здравоохранения США.
""У нас есть... возможность объединить величайшие умы в науке, медицине, промышленности и правительстве, чтобы положить конец эпидемии хронических заболеваний... Вместе мы избавимся от коррупции... и вернем наши агентства здравоохранения к их богатой традиции золотого стандарта, основанной на доказательствах науки"", - написал Кеннеди-младший в социальной сети X.
Дональд Трамп, уже занимавший пост президента США после выборов 2016 года, выиграл президентские выборы, которые прошли 5 ноября. Он стал первым с XIX века политиком в США, кому удалось вернуться в Белый дом после четырехлетнего перерыва. Победу Трампа объявили все ведущие СМИ, ведущие подсчет голосов: агентство Ассошиэйтед Пресс, телеканалы Fox News, CNN,NBC, ABC и CBS.
Кандидат от Демократической партииКамала Харрисвыступила перед сторонниками и заявила, что признает свое поражение, а действующий президент СШАДжо Байденпереговорил с Трампом и поздравил его.
Коллегия выборщиков от штатов 17 декабря должна проголосовать за кандидатов в соответствии с волей избирателей, а 6 января новый состав конгресса утвердит результаты голосования. Инаугурация пройдет 20 января."
2024-11-15 09:02:03,"ИРКУТСК, 15 ноя — РИА Новости.Иностранца из ближнего зарубежья, находящегося в международном розыске по линии Интерпола, задержали в таежном вахтовом поселке на севере Приангарья, сообщаетглавное управление МВДпо Иркутской области.
""В Приангарье полицейские задержали иностранца, находящегося в международном розыске по линии Интерпола. Мужчину, скрывавшегося от правосудия в своем государстве, полицейские нашли в вахтовом поселении в отдаленной части сибирской тайги"", - говорится в сообщении.
Полицейские установили, что 22-летний иностранец совершил тяжкое преступление в отношении несовершеннолетней у себя на родине и в апреле уехал в Россию на заработки. Осенью по каналам Интерпола фигурант был объявлен в международный розыск. Полицейские выяснили, что он находится на севере Приангарья в отдаленной части Бодайбинского района. При этом мигрант имел все необходимые документы для работы на территории РФ. Оперативники при содействии службы безопасности предприятия задержали подозреваемого и доставили в полицию.
В настоящее время мужчина находится под арестом, его готовят к экстрадиции."
2024-11-15 09:15:56,"МОСКВА, 15 ноя - РИА Новости.Московские врачи в 2024 году выходили более 5 тысяч недоношенных детей, а показатель младенческой смертности достиг исторического минимума, сообщила журналистам заммэра столицы по вопросам социального развития Анастасия Ракова.
Международный день недоношенных детей ежегодно отмечается 17 ноября.
""Благодаря четко выстроенной работе акушерско-гинекологической службы столицы только за этот год наши врачи выходили свыше 5 тысяч недоношенных детей. А всего за последние десять лет нам удалось добиться увеличения выживаемости младенцев с низкой массой тела с 90% до 99%… С 2014 года в Москве удалось снизить показатель младенческой смертности в два раза, тем самым достигнув исторического минимума"", - рассказала Ракова.
Она уточнила, что для эффективной помощи будущим мамам и малышам в столице создают новый каркас акушерско-гинекологической службы. Так, в структуре многопрофильных стационаров открываются современные перинатальные центры - специализированные клиники, где высококвалифицированную помощь получают пациентки с различными патологиями, а также новорождённые с рисками перинатальных осложнений.
""В Москве мы создаём все условия для эффективного выхаживания детей, родившихся раньше срока. Своевременная и качественная медпомощь позволяет врачам не только спасать малышей, но и снижать риск развития серьёзных заболеваний в будущем, обеспечивая им здоровое и счастливое детство"", - подчеркнула заммэра."
2024-11-15 09:21:04,"МОСКВА, 15 ноя - РИА Новости.Назначенный украинскими властями глава Херсонской областной военной администрации Александр Прокудин сообщил в своемTelegram-каналео повреждении объекта критической инфраструктуры на подконтрольной ВСУ части Херсонской области.
""Попали в объект критической инфраструктуры… Повреждены газопровод и газораспределительная станция"", - написал Прокудин.
При этом чиновник не уточнил, о каком именно объекте идет речь.
Херсонская область - регионРоссии, расположенный в нижнем течении Днепра, омывается Азовским иЧерным морями. Область стала субъектом РФ по итогам референдума в сентябре 2022 года. Украинская сторона не признаёт его легитимность и продолжает обстреливать территорию. В настоящее время под контролем России находится 75% Херсонской области, а часть на правобережье Днепра, в том числе городХерсон, удерживают украинские войска."
2024-11-15 09:27:23,"НИЖНИЙ НОВГОРОД, 15 ноя - РИА Новости.Прокуратура Новочебоксарска и СК Чувашии организовали проверку по факту массового обращения учащихся и преподавателей школы №4 в медицинские учреждения с симптомами пищевого отравления,сообщаютпресс-службы ведомств.
Ранее пресс-служба главы Чувашии сообщила о том, что 20 человек, в том числе 19 детей, обратились к врачам после посещения школьной столовой в Новочебоксарске, трое из них госпитализированы.
""В ходе организованных прокуратурой проверочных мероприятий будет установлена точная причина обращения детей и преподавателей в медицинские учреждения, дана оценка санитарно-эпидемиологическому состоянию образовательного учреждения, организации питания в школе, а также оценка деятельности юридического лица, осуществляющего поставку продуктов питания"", - говорится в сообщении прокуратуры Чувашии.
Отмечается, что к проверке будут подключены специалисты регионального минздрава иРоспотребнадзора.
В свою очередь региональное управление СКРФинформирует о начавшейся доследственной проверке в школе. ""Следователи выехали на место происшествия. В ближайшее время будет произведен его тщательный осмотр, а также иные необходимые следственные и процессуальные действия. Точное количество пострадавших детей, а также причина заболевания устанавливаются"", - подчеркивается в сообщении."
2024-11-15 09:28:42,"МОСКВА, 15 ноя - РИА Новости.Украинские дроны атаковали автомобиль российской военно-гражданской администрации (ВГА) Харьковской области, никто не пострадал, сообщил глава региона Виталий Ганчев в Telegram-канале.
""Четыре украинских FPV-дрона атаковали автомобиль, на котором сотрудники ВГА доставляли гуманитарные грузы жителям освобождённой территории Харьковской области. Наши коллеги, которые находились в машине, не пострадали. После первого удара они покинули автомобиль и спрятались в укрытие"", - сообщил Ганчев.
По его словам, сильно поврежден автомобиль УАЗ, он был без груза: газовые баллоны сотрудники ВГА успели уже развезти и возвращались обратно."
2024-11-15 09:32:57,"МОСКВА, 15 ноя – РИА Новости.Воздушная тревога объявлена в Киевской, Черкасской, Полтавской областях Украины, свидетельствуют данныеонлайн-картыукраинского министерства цифровой трансформации.
Согласно данным ресурса, тревога в указанных регионах была объявлена в 9.16 мск.
Ранее в пятницу воздушная тревога была объявлена в Черниговской, Сумской иХарьковской областях, там она продолжает действовать.
Удары по украинской инфраструктуреВС РФначали наносить 10 октября 2022 года - через два дня после теракта на Крымском мосту, за которым, по оценке российских властей, стоят украинские спецслужбы. Удары наносятся по объектам энергетики, оборонной промышленности, военного управления и связи. С тех пор воздушная тревога в украинских регионах объявляется каждый день, иногда - по всей стране."
