2024-11-15 05:30:48,"МОСКВА, 15 ноя — РИА Новости.Владимир Зеленский, как и все его окружение, оказался в ситуации, когда он давно стал марионеткой в руках западных стран, включая США, заявил турецкий журналист Джейхун Бозкурт вэфиреканала Ülke TV.
Он, в частности, напомнил о договоренностях междуРоссиейиУкраинойвесной 2022 года вСтамбуле, когда переговорных процесс был сорван по инициативе бывшего премьера БританииБориса Джонсона, призвавшего Зеленского продолжать боевые действия.
""Вы договариваетесь, но затем приходит премьер Британии и заставляет вас отказаться, что означает, что вы не можете действовать без американских инструкций через британских посредников, то есть вы марионетка, и кукловод дергает вас за нитки так, как он хочет"", — отметил эксперт.
При этом он выразил сомнения в том,Дональд Трамп, придя в Белый дом, сможет оказывать аналогичное влияние на киевский режим.
""(Если — Прим. ред.) у Трампа есть в руках волшебная палочка, сможет ли он сделать это с первого раза?"" —задался вопросом журналист.
В СМИ появляется все больше информации касательно вариантов урегулирования конфликта на Украине. Британский журнал The Economist писал, что победивший на выборах президентаСШАДональд Трампможет предложитьКиевупереговоры по ""формуле Вэнса"", которая предполагает исключение вступления Украины вНАТОи отказ от освобожденныхРоссиейтерриторий.
Трамп ранее обещал, что сможет добиться урегулирования украинского конфликта путем переговоров. Кроме того, он не раз заявлял, что сможет разрешить конфликт на Украине за один день. В России считают, что это слишком сложная проблема для такого простого решения. Кроме того, Трамп неоднократно критиковал подход США к конфликту на Украине, а также называл Зеленского ""торгашом"", у которого каждый визит заканчивается многомиллиардной помощью изВашингтона."
2024-11-15 05:32:58,"МОСКВА, 15 ноя - РИА Новости.Российский художник-акционист Петр Павленский до сих пор не оплатил штраф в 500 тысяч рублей, назначенный судом по делу о поджоге двери ФСБ, следует из базы данных судебных приставов и судебных материалов, с которыми ознакомилось РИА Новости.
Павленский обвинялся в ""повреждении объекта культурного наследия — двери здания НКВД-КГБ-ФСБ(1940-1947 годов), которая является частью ансамбля административных зданий ОГПУ-НКВД-КГБ"". Эксперты пришли к выводу, что здание представляет ценность не только как часть ансамбля XIX — начала XX веков, но и как место, где ""содержались под арестом выдающиеся деятели искусства и культуры, военачальники, политические деятели"".
Мещанский судМосквы8 июня 2016 года оштрафовал художника на 500 тысяч рублей, а также взыскал 480 тысяч рублей в рамках гражданского иска спецслужбы, которой пришлось поменять дверь после ""перфоманса"".
После оглашения приговора художника освободили из-под стражи, он сообщил, что не будет платить назначенный судом штраф за сожженную дверь здания ФСБРФна Лубянке.
Согласно данным, с которыми ознакомилось агентство, штраф все еще не оплачен. Это подтверждается данными базы должников службы приставов.
Павленский получил известность в России и за рубежом как исполнитель ряда скандальных акций, в ходе которых он в разное время зашивал себе рот в защиту панк-группыPussy Riot, голым обматывал себя колючей проволокой, прибивал свои половые органы к брусчатке Красной площади, отрезал себе мочку уха и поджигал дверь здания ФСБ РФ.
В 2019 году суд вПарижепризнал его виновным в поджоге банка на площади Бастилии и приговорил к трём годам тюрьмы, два из которых - условно. Поскольку к тому моменту Павленский 11 месяцев провёл в предварительном заключении, он остался на свободе.
Павленскому 18 февраля 2020 года были предъявлены обвинения по делу о распространении интимных видео якобы с бывшим кандидатом на пост мэра Парижа Бенжамином Гриво. Он был отпущен на свободу и помещен под судебный контроль. Такая же мера пресечения была выбрана для его подруги Александры де Таддео, которая также фигурирует в деле о распространении интимных видео. После распространения видео в середине февраля кандидат от президентской партии ""Вперед, республика"" снялся с выборов мэра Парижа. Гриво подал жалобу на ""вмешательство в личную жизнь"". Согласно французскому законодательству, за распространение видео сексуального характера без разрешения автора могут грозить до двух лет тюрьмы и штраф.
В октябре 2023 года суд воФранцииприговорил Павленского к шести месяцам в тюрьме по делу о распространении интимных видео с участием Гриво, наказание он отбывает дома с электронным браслетом."
2024-11-15 05:36:53,"ДОНЕЦК, 15 ноя - РИА Новости.Инструктор из США учил военнослужащих ВСУ не брать еду даже у украинцев и всегда носить оружие со снятым предохранителем, рассказал РИА Новости украинский военнопленный Игорь Мартыненко.
Украинец 1975 года рождения родом изНиколаевской областибыл мобилизован 15 мая 2023 года, в августе того же года он дезертировал из украинской армии и полтора года скрывался в прифронтовой зоне.
По словам пленного, военнослужащих 37-й бригады морской пехоты ВСУ обучал инструктор из США.
""Рассказывали, как себя надо вести с населением, что нельзя ничего пить, есть, не брать ничего в руки, даже если это мое, я украинец, и вУкраиненахожусь, мне запрещали попить водички, что меня могут обнулить (убить - ред.)"", - рассказал Мартыненко агентству.
Также он добавил, что инструкторы просили всегда ходить в полной экипировке, с оружием на изготовку и со снятым с предохранителем, из-за чего случались конфликты с местным населением."
2024-11-15 05:37:40,"МОСКВА, 15 ноя — РИА Новости.Совместная фотография действующего и будущего президентов США Дональда Трампа и Джо Байдена, позировавшего вместе со своей женой Джилл, демонстрирует лицемерие американского истеблишмента. Такое мнение высказал глава комиссии Совфеда по информполитике Алексей Пушков вTelegram-канале.
Сенатор обратил внимание на то, что на фотографии отсутствует жена Трампа Мелания, которая отказалась ехать в Белый дом на встречу ее мужа Байденом и его супругой.
""При этом жена Трампа ехать на встречу пить чай с женой Байдена наотрез отказалась. <…> И делать вид, что все ОК, как предписывает американское лицемерие, не захотела"", — резюмировал Пушков, отметив, что она не может забыть обыски в имении Трампов, санкционированные Байденом.
Встреча Байдена и Трампа в Белом доме по вопросу передачи власти состоялась в среду. По словам пресс-секретаря БайденаКарин Жан-Пьер, действующий президент в ходе беседы с победителем выборов подтвердил, что передача власти пройдет в мирном и упорядоченном формате."
2024-11-15 05:52:00,"СИМФЕРОПОЛЬ, 15 ноя – РИА Новости.Российский астроном Геннадий Борисов во время наблюдений в Крыму открыл новую комету, ставшую 13-й в его списке открытых комет и названной C/2024 V1 (Borisov), информацию Центра малых планет об этом астроном подтвердил РИА Новости.
""В ночь на 8 ноября во время наблюдений в Научном (посёлок в Крыму - ред.) я обнаружил новый объект, который изначально посчитал астероидом. Последующие наблюдения и сделанные снимки показали его диффузность и малый хвост - всего несколько угловых секунд, что является признаком кометы. Информацию я переслал в Центр малых планет. И вот только что вышел циркуляр Центра, в котором официально сообщается об открытии новой кометы"", - сказал Борисов.
Комете присвоено имя C/2024 V1 (Borisov). Астроном сделал открытие с помощью телескопа-рефлектора, построенного им самим с диаметром зеркала 50 сантиметров. Комета в момент открытия находилась в созвездии Большая Медведица, ее яркость составляла 21 звездную величину. Размеры кометы, по словам Борисова, составляют порядка нескольких сотен метров.
Точку перигелия - ближайшую к Солнцу - комета пройдет 4 апреля 2025 года на расстоянии порядка 2,3 астрономических единиц. По предварительным расчетам, открытая астрономом комета имеет вытянутую эллиптическую орбиту, период ее обращения превышает 3,7 тысячи лет.
Астроном сказал, что C/2024 V1 (Borisov) стала 13-й открытой им кометой, таким образом он вышел на второе место среди астрономов в мире по числу открытых комет.
Геннадий Борисов – астроном, работающий в Крыму, в посёлке Научный. Свои наблюдения он проводит с помощью созданного им самим телескопа. Особую известность принесла астроному открытая им в 2019 году первая межзвездная комета (2I/Borisov), которая появилась из дальнего космоса и навсегда покинула Солнечную систему. На счету Борисова также несколько десятков открытых астероидов."
2024-11-15 05:54:03,"МОСКВА, 15 ноя - РИА Новости.Россия будет наращивать объёмы гуманитарной помощи Кубе, сообщил глава МЧС РФ Александр Куренков на встрече с генералом армии Раулем Кастро, говорится в Telegram-канале российского министерства.
""Знаем про ураганы, прошедшие недавно по территории Кубы. С большим сочувствием относимся ко всем бедам, с которыми сталкивается братский кубинский народ. Уже сейчас мы привезли гуманитарные грузы, которые особенно востребованы при чрезвычайных ситуациях. Это фильтры для воды, санитарные сумки, продукты питания и медикаменты. Будем и дальше наращивать объемы помощи. Мы оцениваем взаимодействие с кубинской стороной как перспективное и долгосрочное, отвечающее стратегическим интересам наших стран"", - сказал Куренков.
В Telegram-канале ведомства также сообщается, что МЧС России всегда будет стремиться к укреплению и плодотворному развитию взаимодействия чрезвычайных ведомств. Также глава МЧС служб поделился с Кастро результатами работы российской делегации вГаване, эффективностью Регионального российско-кубинского центра."
2024-11-15 05:59:52,"МОСКВА, 15 ноя - РИА Новости.Дональд Трамп, победивший на президентских выборах в США, в четверг встретился с президентом Аргентины Хавьером Милеем, следует из сообщения пресс-секретаря южноамериканского лидера Мануэля Адорни в социальных сетях.
Встреча состоялась во флоридском поместье Трампа Мар-а-Лаго.
Адорни опубликовал в социальной сети Х фотографию, на которой слева направо позируют глава аргентинского МИД Херардо Вертейн, предпринимательИлон Маск, Милей, Трамп и сестра Милея Карина. Маск, который в последнее время играет роль неформального, но очень близкого советника Трампа, держит на руках маленькую девочку.
Таким образом Милей стал первым иностранным лидером, который встретился с избранным президентом США.
Агентство Ассошиэйтед Пресс со ссылкой на источники сообщает, что встреча прошла хорошо, Милей также встретился с американскими инвесторами."
2024-11-15 06:01:54,"СИМФЕРОПОЛЬ, 15 ноя – РИА Новости.Глава крымского парламента Владимир Константинов заявил РИА Новости, что полуостров открыт для инвестиций американского предпринимателя Илона Маска.
По его словам, вкладывать инвестиции в Россию выгодно.
""У нас есть ресурсы, ограниченные на планетеЗемля. У него же — есть технологии, наука. Может хорошая связка получиться"", - подчеркнул глава парламента."
2024-11-15 06:04:13,"ДОНЕЦК, 15 ноя - РИА Новости.Иностранные наемники не смогут досрочно расторгать контракт с ВСУ, рассказал РИА Новости военнопленный Денис Дунякин.
Дунякин 1994 года рождения мобилизовали изКривого Рогав сентябре, в плен попал в селе Шахтерское вДНР.
""Рассказывали, что контракт был на год (У иностранных наемников. — Прим. ред.) с разрешением, типа в любой момент можешь расторгнуть контракт, а теперь, я слышал, что будут делать контракт на полгода без расторжения"", — рассказал собеседник агентства.
Эту информацию он узнал во время обучения, когда на полигоне с ним тренировались наемники изКолумбии."
2024-11-15 06:26:50,"МОСКВА, 15 ноя – РИА Новости.Не менее 46 беспилотников подавили за ночь в Крымском районе Кубани, сообщил глава района Сергей Лесь в своемTelegram-канале.
Пострадавших среди мирных жителей нет, добавил он.
ВСУ ежедневно пытаются атаковать беспилотниками объекты в приграничных и центральных регионах России. Системы ПВО уничтожают большинство дронов."
2024-11-15 06:35:04,"МОСКВА, 15 ноя - РИА Новости.Щербинский суд Москвы оштрафовал москвича, который поджег стихийный мемориал жертвам теракта в ""Крокус сити холле"" в поселении Десеновское, говорится в приговоре суда, который есть в распоряжении РИА Новости.
Согласно материалам дела, осужденный через несколько дней после теракта поздно ночью гулял около дома и увидел около камня-памятника воинам-участникам локальных конфликтов, установленного рядом со школой, мягкие игрушки, которые были оставлены ""неравнодушными гражданами Российской Федерации, выразившими свою скорбь в память о жертвах террористического акта"". Мужчина достал зажигалку и поджег игрушки. В результате открытого горения на закладном камне образовались повреждения в виде гари и копоти. В результате преступных действий разрушение закладного камня не произошло, были сильные загрязнения, устранение которых у клининговой службы заняло почти два часа.
""Суд считает, что цели наказания будут достигнуты при назначении наказания в виде штрафа"", - сказано в приговоре суда.
Зажигалку, признанную вещественным доказательством, суд постановил уничтожить."
2024-11-15 06:38:14,"МОСКВА, 15 ноя – РИА Новости.Более 500 военнослужащих армии США покончили жизнь самоубийством в 2023 году, что превышает показатели 2022 года, сообщает Пентагон.
""За 2023 календарный год 523 военнослужащих покончили жизнь самоубийством, что превышает показатели предыдущего года (493)"", - говорится в заявлении на сайте ведомства.
Отмечается, что в общей сложности число случаев суицида на 100 тысяч военных выросло на 9%. В большинстве инцидентов с жизнью расставались молодые военнослужащие.
В марте 2023 года глава ПентагонаЛлойд Остинприказал улучшить доступ военных к получению психологической помощи, чтобы снизить количество самоубийств в американской армии на фоне увеличения числа суицидов в регулярных войсках."
